{
  "schema_version": "2.0.0",
  "record_id": "FIXTURE-ACTIVATION",
  "synthetic": true,
  "core_release_id": "FIXTURE-CORE-IDENTIFIABILITY",
  "capability_snapshot_id": "FIXTURE-CAPABILITIES-NO-DATA",
  "status": "DEFERRED_NO_DATA",
  "candidate_modules": [],
  "reasons": [
    "No original observations."
  ],
  "scientific_authorisation": false,
  "reviewer_receipts": [],
  "core_modified": false,
  "permitted_roles": [],
  "limitations": [
    "Synthetic reference fixture only."
  ]
}
